Running 32 configurations...
Each config: 5 epochs, 5000 samples


============================================================
[1/32] ch1_ts300_pred_noise_mse_full
============================================================
Device: cuda
Config: channels=1, timesteps=300, objective=pred_noise, loss=mse, train_style=full
Found 5000 healthy scans
Train: 4500, Val: 500
Parameters: 30,022,849
  Evaluating...
Epoch 1: Loss=0.070688, ROC-AUC=0.7408
  Evaluating...
Epoch 2: Loss=0.035315, ROC-AUC=0.7304
  Evaluating...
Epoch 3: Loss=0.031806, ROC-AUC=0.7428
  Evaluating...
Epoch 4: Loss=0.028409, ROC-AUC=0.7368
  Evaluating...
Epoch 5: Loss=0.027538, ROC-AUC=0.7072
Best ROC-AUC: 0.7428 at epoch 3

============================================================
[2/32] ch1_ts300_pred_noise_mse_patched
============================================================
Device: cuda
Config: channels=1, timesteps=300, objective=pred_noise, loss=mse, train_style=patched
Found 5000 healthy scans
Train: 4500, Val: 500
Parameters: 30,022,849
  Evaluating...
Epoch 1: Loss=0.001324, ROC-AUC=0.7348
  Evaluating...
Epoch 2: Loss=0.000005, ROC-AUC=0.7316
  Evaluating...
Epoch 3: Loss=0.000002, ROC-AUC=0.7396
  Evaluating...
Epoch 4: Loss=0.000001, ROC-AUC=0.7336
  Evaluating...
Epoch 5: Loss=0.000001, ROC-AUC=0.7416
Best ROC-AUC: 0.7416 at epoch 5

============================================================
[3/32] ch1_ts300_pred_noise_mse_ssim_full
============================================================
Device: cuda
Config: channels=1, timesteps=300, objective=pred_noise, loss=mse_ssim, train_style=full
Found 5000 healthy scans
Train: 4500, Val: 500
Parameters: 30,022,849
  Evaluating...
Epoch 1: Loss=0.070691, ROC-AUC=0.7404
  Evaluating...
Epoch 2: Loss=0.035329, ROC-AUC=0.7296
  Evaluating...
Epoch 3: Loss=0.031806, ROC-AUC=0.7368
  Evaluating...
Epoch 4: Loss=0.028349, ROC-AUC=0.7388
  Evaluating...
Epoch 5: Loss=0.027246, ROC-AUC=0.7096
Best ROC-AUC: 0.7404 at epoch 1

============================================================
[4/32] ch1_ts300_pred_noise_mse_ssim_patched
============================================================
Device: cuda
Config: channels=1, timesteps=300, objective=pred_noise, loss=mse_ssim, train_style=patched
Found 5000 healthy scans
Train: 4500, Val: 500
Parameters: 30,022,849
  Evaluating...
Epoch 1: Loss=0.001324, ROC-AUC=0.7348
  Evaluating...
Epoch 2: Loss=0.000005, ROC-AUC=0.7316
  Evaluating...
Epoch 3: Loss=0.000002, ROC-AUC=0.7396
  Evaluating...
Epoch 4: Loss=0.000001, ROC-AUC=0.7336
  Evaluating...
Epoch 5: Loss=0.000001, ROC-AUC=0.7416
Best ROC-AUC: 0.7416 at epoch 5

============================================================
[5/32] ch1_ts300_pred_x0_mse_full
============================================================
Device: cuda
Config: channels=1, timesteps=300, objective=pred_x0, loss=mse, train_style=full
Found 5000 healthy scans
Train: 4500, Val: 500
Parameters: 30,022,849
  Evaluating...
Epoch 1: Loss=0.055388, ROC-AUC=0.3232
  Evaluating...
Epoch 2: Loss=0.046313, ROC-AUC=0.3008
  Evaluating...
Epoch 3: Loss=0.041317, ROC-AUC=0.4824
  Evaluating...
Epoch 4: Loss=0.038375, ROC-AUC=0.4244
  Evaluating...
Epoch 5: Loss=0.037990, ROC-AUC=0.3860
Best ROC-AUC: 0.4824 at epoch 3

============================================================
[6/32] ch1_ts300_pred_x0_mse_patched
============================================================
Device: cuda
Config: channels=1, timesteps=300, objective=pred_x0, loss=mse, train_style=patched
Found 5000 healthy scans
Train: 4500, Val: 500
Parameters: 30,022,849
  -> Failed: division by zero

============================================================
[7/32] ch1_ts300_pred_x0_mse_ssim_full
============================================================
Device: cuda
Config: channels=1, timesteps=300, objective=pred_x0, loss=mse_ssim, train_style=full
Found 5000 healthy scans
Train: 4500, Val: 500
Parameters: 30,022,849
  Evaluating...
Epoch 1: Loss=0.267715, ROC-AUC=0.3916
  Evaluating...
Epoch 2: Loss=0.231546, ROC-AUC=0.2996
  Evaluating...
Epoch 3: Loss=0.214194, ROC-AUC=0.3412
  Evaluating...
Epoch 4: Loss=0.207509, ROC-AUC=0.3060
  Evaluating...
Epoch 5: Loss=0.205569, ROC-AUC=0.3116
Best ROC-AUC: 0.3916 at epoch 1

============================================================
[8/32] ch1_ts300_pred_x0_mse_ssim_patched
============================================================
Device: cuda
Config: channels=1, timesteps=300, objective=pred_x0, loss=mse_ssim, train_style=patched
Found 5000 healthy scans
Train: 4500, Val: 500
Parameters: 30,022,849
  Evaluating...
Epoch 1: Loss=0.386319, ROC-AUC=0.6504
  Evaluating...
Epoch 2: Loss=0.332963, ROC-AUC=0.6540
  Evaluating...
Epoch 3: Loss=0.313532, ROC-AUC=0.6552
  Evaluating...
Epoch 4: Loss=0.313229, ROC-AUC=0.6460
  Evaluating...
Epoch 5: Loss=0.309737, ROC-AUC=0.6420
Best ROC-AUC: 0.6552 at epoch 3

============================================================
[9/32] ch1_ts1000_pred_noise_mse_full
============================================================
Device: cuda
Config: channels=1, timesteps=1000, objective=pred_noise, loss=mse, train_style=full
Found 5000 healthy scans
Train: 4500, Val: 500
Parameters: 30,022,849
  Evaluating...
Epoch 1: Loss=0.070097, ROC-AUC=0.6772
  Evaluating...
Epoch 2: Loss=0.035104, ROC-AUC=0.6704
  Evaluating...
Epoch 3: Loss=0.030430, ROC-AUC=0.5380
  Evaluating...
Epoch 4: Loss=0.027144, ROC-AUC=0.4732
  Evaluating...
Epoch 5: Loss=0.026680, ROC-AUC=0.4336
Best ROC-AUC: 0.6772 at epoch 1

============================================================
[10/32] ch1_ts1000_pred_noise_mse_patched
============================================================
Device: cuda
Config: channels=1, timesteps=1000, objective=pred_noise, loss=mse, train_style=patched
Found 5000 healthy scans
Train: 4500, Val: 500
Parameters: 30,022,849
  Evaluating...
Epoch 1: Loss=0.001307, ROC-AUC=0.7304
  Evaluating...
Epoch 2: Loss=0.000005, ROC-AUC=0.7276
  Evaluating...
Epoch 3: Loss=0.000001, ROC-AUC=0.7300
  Evaluating...
Epoch 4: Loss=0.000001, ROC-AUC=0.7304
  Evaluating...
Epoch 5: Loss=0.000001, ROC-AUC=0.7360
Best ROC-AUC: 0.7360 at epoch 5

============================================================
[11/32] ch1_ts1000_pred_noise_mse_ssim_full
============================================================
Device: cuda
Config: channels=1, timesteps=1000, objective=pred_noise, loss=mse_ssim, train_style=full
Found 5000 healthy scans
Train: 4500, Val: 500
Parameters: 30,022,849
  Evaluating...
Epoch 1: Loss=0.070096, ROC-AUC=0.6776
  Evaluating...
Epoch 2: Loss=0.035146, ROC-AUC=0.6416
  Evaluating...
Epoch 3: Loss=0.030533, ROC-AUC=0.5656
  Evaluating...
Epoch 4: Loss=0.027078, ROC-AUC=0.5404
  Evaluating...
Epoch 5: Loss=0.026859, ROC-AUC=0.4572
Best ROC-AUC: 0.6776 at epoch 1

============================================================
[12/32] ch1_ts1000_pred_noise_mse_ssim_patched
============================================================
Device: cuda
Config: channels=1, timesteps=1000, objective=pred_noise, loss=mse_ssim, train_style=patched
Found 5000 healthy scans
Train: 4500, Val: 500
Parameters: 30,022,849
  Evaluating...
Epoch 1: Loss=0.001307, ROC-AUC=0.7304
  Evaluating...
Epoch 2: Loss=0.000005, ROC-AUC=0.7276
  Evaluating...
Epoch 3: Loss=0.000002, ROC-AUC=0.7300
  Evaluating...
Epoch 4: Loss=0.000001, ROC-AUC=0.7304
  Evaluating...
Epoch 5: Loss=0.000001, ROC-AUC=0.7356
Best ROC-AUC: 0.7356 at epoch 5

============================================================
[13/32] ch1_ts1000_pred_x0_mse_full
============================================================
Device: cuda
Config: channels=1, timesteps=1000, objective=pred_x0, loss=mse, train_style=full
Found 5000 healthy scans
Train: 4500, Val: 500
Parameters: 30,022,849
  Evaluating...
Epoch 1: Loss=0.056000, ROC-AUC=0.6772
  Evaluating...
Epoch 2: Loss=0.045207, ROC-AUC=0.6900
  Evaluating...
Epoch 3: Loss=0.041653, ROC-AUC=0.6944
  Evaluating...
Epoch 4: Loss=0.039738, ROC-AUC=0.6928
  Evaluating...
Epoch 5: Loss=0.035730, ROC-AUC=0.6992
Best ROC-AUC: 0.6992 at epoch 5

============================================================
[14/32] ch1_ts1000_pred_x0_mse_patched
============================================================
Device: cuda
Config: channels=1, timesteps=1000, objective=pred_x0, loss=mse, train_style=patched
Found 5000 healthy scans
Train: 4500, Val: 500
Parameters: 30,022,849
  -> Failed: division by zero

============================================================
[15/32] ch1_ts1000_pred_x0_mse_ssim_full
============================================================
Device: cuda
Config: channels=1, timesteps=1000, objective=pred_x0, loss=mse_ssim, train_style=full
Found 5000 healthy scans
Train: 4500, Val: 500
Parameters: 30,022,849
  Evaluating...
Epoch 1: Loss=0.265022, ROC-AUC=0.7496
  Evaluating...
Epoch 2: Loss=0.231345, ROC-AUC=0.6924
  Evaluating...
Epoch 3: Loss=0.218910, ROC-AUC=0.7108
  Evaluating...
Epoch 4: Loss=0.213632, ROC-AUC=0.6828
  Evaluating...
Epoch 5: Loss=0.202628, ROC-AUC=0.6260
Best ROC-AUC: 0.7496 at epoch 1

============================================================
[16/32] ch1_ts1000_pred_x0_mse_ssim_patched
============================================================
Device: cuda
Config: channels=1, timesteps=1000, objective=pred_x0, loss=mse_ssim, train_style=patched
Found 5000 healthy scans
Train: 4500, Val: 500
Parameters: 30,022,849
  Evaluating...
Epoch 1: Loss=0.402330, ROC-AUC=0.7036
  Evaluating...
Epoch 2: Loss=0.331397, ROC-AUC=0.6896
  Evaluating...
Epoch 3: Loss=0.319265, ROC-AUC=0.7040
  Evaluating...
Epoch 4: Loss=0.309851, ROC-AUC=0.6944
  Evaluating...
Epoch 5: Loss=0.301207, ROC-AUC=0.6888
Best ROC-AUC: 0.7040 at epoch 3

============================================================
[17/32] ch3_ts300_pred_noise_mse_full
============================================================
Device: cuda
Config: channels=3, timesteps=300, objective=pred_noise, loss=mse, train_style=full
Found 5000 healthy scans
Train: 4500, Val: 500
Parameters: 30,025,155
  Evaluating...
Epoch 1: Loss=0.103098, ROC-AUC=0.7224
  Evaluating...
Epoch 2: Loss=0.040955, ROC-AUC=0.7304
  Evaluating...
Epoch 3: Loss=0.029989, ROC-AUC=0.7256
  Evaluating...
Epoch 4: Loss=0.024052, ROC-AUC=0.7292
  Evaluating...
Epoch 5: Loss=0.021862, ROC-AUC=0.7296
Best ROC-AUC: 0.7304 at epoch 2

============================================================
[18/32] ch3_ts300_pred_noise_mse_patched
============================================================
Device: cuda
Config: channels=3, timesteps=300, objective=pred_noise, loss=mse, train_style=patched
Found 5000 healthy scans
Train: 4500, Val: 500
Parameters: 30,025,155
  Evaluating...
Epoch 1: Loss=0.001158, ROC-AUC=0.7052
  Evaluating...
Epoch 2: Loss=0.000014, ROC-AUC=0.7052
  Evaluating...
Epoch 3: Loss=0.000005, ROC-AUC=0.7048
  Evaluating...
Epoch 4: Loss=0.000003, ROC-AUC=0.7068
  Evaluating...
Epoch 5: Loss=0.000002, ROC-AUC=0.7020
Best ROC-AUC: 0.7068 at epoch 4

============================================================
[19/32] ch3_ts300_pred_noise_mse_ssim_full
============================================================
Device: cuda
Config: channels=3, timesteps=300, objective=pred_noise, loss=mse_ssim, train_style=full
Found 5000 healthy scans
Train: 4500, Val: 500
Parameters: 30,025,155
  Evaluating...
Epoch 1: Loss=0.103085, ROC-AUC=0.7260
  Evaluating...
Epoch 2: Loss=0.041043, ROC-AUC=0.7284
  Evaluating...
Epoch 3: Loss=0.029941, ROC-AUC=0.7204
  Evaluating...
Epoch 4: Loss=0.023981, ROC-AUC=0.7220
  Evaluating...
Epoch 5: Loss=0.021940, ROC-AUC=0.7208
Best ROC-AUC: 0.7284 at epoch 2

============================================================
[20/32] ch3_ts300_pred_noise_mse_ssim_patched
============================================================
Device: cuda
Config: channels=3, timesteps=300, objective=pred_noise, loss=mse_ssim, train_style=patched
Found 5000 healthy scans
Train: 4500, Val: 500
Parameters: 30,025,155
  Evaluating...
Epoch 1: Loss=0.001152, ROC-AUC=0.7068
  Evaluating...
Epoch 2: Loss=0.000011, ROC-AUC=0.7056
  Evaluating...
Epoch 3: Loss=0.000008, ROC-AUC=0.7036
  Evaluating...
Epoch 4: Loss=0.000004, ROC-AUC=0.7068
  Evaluating...
Epoch 5: Loss=0.000002, ROC-AUC=0.7020
Best ROC-AUC: 0.7068 at epoch 1

============================================================
[21/32] ch3_ts300_pred_x0_mse_full
============================================================
Device: cuda
Config: channels=3, timesteps=300, objective=pred_x0, loss=mse, train_style=full
Found 5000 healthy scans
Train: 4500, Val: 500
Parameters: 30,025,155
  Evaluating...
Epoch 1: Loss=0.040434, ROC-AUC=0.3908
  Evaluating...
Epoch 2: Loss=0.026831, ROC-AUC=0.4292
  Evaluating...
Epoch 3: Loss=0.025026, ROC-AUC=0.3400
  Evaluating...
Epoch 4: Loss=0.024493, ROC-AUC=0.4272
  Evaluating...
Epoch 5: Loss=0.022630, ROC-AUC=0.4028
Best ROC-AUC: 0.4292 at epoch 2

============================================================
[22/32] ch3_ts300_pred_x0_mse_patched
============================================================
Device: cuda
Config: channels=3, timesteps=300, objective=pred_x0, loss=mse, train_style=patched
Found 5000 healthy scans
Train: 4500, Val: 500
Parameters: 30,025,155
  -> Failed: division by zero

============================================================
[23/32] ch3_ts300_pred_x0_mse_ssim_full
============================================================
Device: cuda
Config: channels=3, timesteps=300, objective=pred_x0, loss=mse_ssim, train_style=full
Found 5000 healthy scans
Train: 4500, Val: 500
Parameters: 30,025,155
  Evaluating...
Epoch 1: Loss=0.236380, ROC-AUC=0.4356
  Evaluating...
Epoch 2: Loss=0.178184, ROC-AUC=0.3892
  Evaluating...
Epoch 3: Loss=0.166054, ROC-AUC=0.3632
  Evaluating...
Epoch 4: Loss=0.161658, ROC-AUC=0.3512
  Evaluating...
Epoch 5: Loss=0.155693, ROC-AUC=0.3424
Best ROC-AUC: 0.4356 at epoch 1

============================================================
[24/32] ch3_ts300_pred_x0_mse_ssim_patched
============================================================
Device: cuda
Config: channels=3, timesteps=300, objective=pred_x0, loss=mse_ssim, train_style=patched
Found 5000 healthy scans
Train: 4500, Val: 500
Parameters: 30,025,155
  Evaluating...
Epoch 1: Loss=0.329624, ROC-AUC=0.6196
  Evaluating...
Epoch 2: Loss=0.243707, ROC-AUC=0.6368
  Evaluating...
Epoch 3: Loss=0.228855, ROC-AUC=0.6288
  Evaluating...
Epoch 4: Loss=0.222684, ROC-AUC=0.6348
  Evaluating...
Epoch 5: Loss=0.217617, ROC-AUC=0.6296
Best ROC-AUC: 0.6368 at epoch 2

============================================================
[25/32] ch3_ts1000_pred_noise_mse_full
============================================================
Device: cuda
Config: channels=3, timesteps=1000, objective=pred_noise, loss=mse, train_style=full
Found 5000 healthy scans
Train: 4500, Val: 500
Parameters: 30,025,155
  Evaluating...
Epoch 1: Loss=0.104134, ROC-AUC=0.7080
  Evaluating...
Epoch 2: Loss=0.040845, ROC-AUC=0.6868
  Evaluating...
Epoch 3: Loss=0.029709, ROC-AUC=0.7068
  Evaluating...
Epoch 4: Loss=0.025019, ROC-AUC=0.7068
  Evaluating...
Epoch 5: Loss=0.021775, ROC-AUC=0.6976
Best ROC-AUC: 0.7080 at epoch 1

============================================================
[26/32] ch3_ts1000_pred_noise_mse_patched
============================================================
Device: cuda
Config: channels=3, timesteps=1000, objective=pred_noise, loss=mse, train_style=patched
Found 5000 healthy scans
Train: 4500, Val: 500
Parameters: 30,025,155
  Evaluating...
Epoch 1: Loss=0.001143, ROC-AUC=0.7004
  Evaluating...
Epoch 2: Loss=0.000012, ROC-AUC=0.6980
  Evaluating...
Epoch 3: Loss=0.000005, ROC-AUC=0.7000
  Evaluating...
Epoch 4: Loss=0.000006, ROC-AUC=0.6988
  Evaluating...
Epoch 5: Loss=0.000002, ROC-AUC=0.6964
Best ROC-AUC: 0.7004 at epoch 1

============================================================
[27/32] ch3_ts1000_pred_noise_mse_ssim_full
============================================================
Device: cuda
Config: channels=3, timesteps=1000, objective=pred_noise, loss=mse_ssim, train_style=full
Found 5000 healthy scans
Train: 4500, Val: 500
Parameters: 30,025,155
  Evaluating...
Epoch 1: Loss=0.104164, ROC-AUC=0.7108
  Evaluating...
Epoch 2: Loss=0.040878, ROC-AUC=0.7080
  Evaluating...
Epoch 3: Loss=0.029696, ROC-AUC=0.7020
  Evaluating...
Epoch 4: Loss=0.024839, ROC-AUC=0.6968
  Evaluating...
Epoch 5: Loss=0.021551, ROC-AUC=0.6988
Best ROC-AUC: 0.7108 at epoch 1

============================================================
[28/32] ch3_ts1000_pred_noise_mse_ssim_patched
============================================================
Device: cuda
Config: channels=3, timesteps=1000, objective=pred_noise, loss=mse_ssim, train_style=patched
Found 5000 healthy scans
Train: 4500, Val: 500
Parameters: 30,025,155
  Evaluating...
Epoch 1: Loss=0.001138, ROC-AUC=0.6996
  Evaluating...
Epoch 2: Loss=0.000012, ROC-AUC=0.6988
  Evaluating...
Epoch 3: Loss=0.000005, ROC-AUC=0.7000
  Evaluating...
Epoch 4: Loss=0.000005, ROC-AUC=0.6988
  Evaluating...
Epoch 5: Loss=0.000002, ROC-AUC=0.6964
Best ROC-AUC: 0.7000 at epoch 3

============================================================
[29/32] ch3_ts1000_pred_x0_mse_full
============================================================
Device: cuda
Config: channels=3, timesteps=1000, objective=pred_x0, loss=mse, train_style=full
Found 5000 healthy scans
Train: 4500, Val: 500
Parameters: 30,025,155
  Evaluating...
Epoch 1: Loss=0.036862, ROC-AUC=0.6816
  Evaluating...
Epoch 2: Loss=0.027985, ROC-AUC=0.6896
  Evaluating...
Epoch 3: Loss=0.025786, ROC-AUC=0.6892
  Evaluating...
Epoch 4: Loss=0.022818, ROC-AUC=0.6748
  Evaluating...
Epoch 5: Loss=0.021847, ROC-AUC=0.6700
Best ROC-AUC: 0.6896 at epoch 2

============================================================
[30/32] ch3_ts1000_pred_x0_mse_patched
============================================================
Device: cuda
Config: channels=3, timesteps=1000, objective=pred_x0, loss=mse, train_style=patched
Found 5000 healthy scans
Train: 4500, Val: 500
Parameters: 30,025,155
  -> Failed: division by zero

============================================================
[31/32] ch3_ts1000_pred_x0_mse_ssim_full
============================================================
Device: cuda
Config: channels=3, timesteps=1000, objective=pred_x0, loss=mse_ssim, train_style=full
Found 5000 healthy scans
Train: 4500, Val: 500
Parameters: 30,025,155
  Evaluating...
Epoch 1: Loss=0.228528, ROC-AUC=0.6828
  Evaluating...
Epoch 2: Loss=0.181701, ROC-AUC=0.6952
  Evaluating...
Epoch 3: Loss=0.170514, ROC-AUC=0.6300
  Evaluating...
Epoch 4: Loss=0.159293, ROC-AUC=0.6856
  Evaluating...
Epoch 5: Loss=0.153481, ROC-AUC=0.6900
Best ROC-AUC: 0.6952 at epoch 2

============================================================
[32/32] ch3_ts1000_pred_x0_mse_ssim_patched
============================================================
Device: cuda
Config: channels=3, timesteps=1000, objective=pred_x0, loss=mse_ssim, train_style=patched
Found 5000 healthy scans
Train: 4500, Val: 500
Parameters: 30,025,155
  Evaluating...
Epoch 1: Loss=0.337903, ROC-AUC=0.6816
  Evaluating...
Epoch 2: Loss=0.248900, ROC-AUC=0.6800
  Evaluating...
Epoch 3: Loss=0.232767, ROC-AUC=0.6660
  Evaluating...
Epoch 4: Loss=0.224570, ROC-AUC=0.6832
  Evaluating...
Epoch 5: Loss=0.217235, ROC-AUC=0.6748
Best ROC-AUC: 0.6832 at epoch 4

============================================================
SWEEP RESULTS (sorted by ROC-AUC)
============================================================
ROC-AUC: 0.7496 | ch=1, ts=1000, pred_x0, mse_ssim, full
ROC-AUC: 0.7428 | ch=1, ts=300, pred_noise, mse, full
ROC-AUC: 0.7416 | ch=1, ts=300, pred_noise, mse, patched
ROC-AUC: 0.7416 | ch=1, ts=300, pred_noise, mse_ssim, patched
ROC-AUC: 0.7404 | ch=1, ts=300, pred_noise, mse_ssim, full
ROC-AUC: 0.7360 | ch=1, ts=1000, pred_noise, mse, patched
ROC-AUC: 0.7356 | ch=1, ts=1000, pred_noise, mse_ssim, patched
ROC-AUC: 0.7304 | ch=3, ts=300, pred_noise, mse, full
ROC-AUC: 0.7284 | ch=3, ts=300, pred_noise, mse_ssim, full
ROC-AUC: 0.7108 | ch=3, ts=1000, pred_noise, mse_ssim, full

Full results saved to sweep_results/all_results.json
